[
  {
    "invocation": {
      "id": "inv-001",
      "affordance": "startOnboarding",
      "timestamp": "2026-10-02T19:28:30.070Z",
      "request": {
        "method": "POST",
        "url": "http://localhost:3001/onboarding",
        "headers": {},
        "body": null
      }
    },
    "response": {
      "status": 200,
      "headers": {
        "connection": "keep-alive",
        "content-type": "application/json",
        "date": "Fri, 02 Oct 2026 19:28:30 GMT",
        "keep-alive": "timeout=5",
        "transfer-encoding": "chunked"
      },
      "body": {
        "onboardingId": "ONB-7cc77b5c"
      }
    },
    "outputs": {
      "onboardingId": "ONB-7cc77b5c"
    },
    "result": "SUCCESS"
  },
  {
    "invocation": {
      "id": "inv-002",
      "affordance": "createCustomerProfile",
      "timestamp": "2026-10-02T19:28:30.086Z",
      "request": {
        "method": "POST",
        "url": "http://localhost:3001/customers",
        "headers": {
          "Content-Type": "application/json"
        },
        "body": {
          "onboardingId": "ONB-7cc77b5c",
          "name": "Jordan"
        }
      }
    },
    "response": {
      "status": 200,
      "headers": {
        "connection": "keep-alive",
        "content-type": "application/json",
        "date": "Fri, 02 Oct 2026 19:28:30 GMT",
        "keep-alive": "timeout=5",
        "transfer-encoding": "chunked"
      },
      "body": {
        "customerId": "CUS-3d786679"
      }
    },
    "outputs": {
      "customerId": "CUS-3d786679"
    },
    "result": "SUCCESS"
  },
  {
    "invocation": {
      "id": "inv-003",
      "affordance": "setCustomerAddress",
      "timestamp": "2026-10-02T19:28:30.091Z",
      "request": {
        "method": "PUT",
        "url": "http://localhost:3001/customers/CUS-3d786679/address",
        "headers": {
          "Content-Type": "application/json"
        },
        "body": {
          "street": "100 Main Street",
          "city": "Cincinnati",
          "state": "OH",
          "postalCode": "45202"
        }
      }
    },
    "response": {
      "status": 200,
      "headers": {
        "connection": "keep-alive",
        "content-type": "application/json",
        "date": "Fri, 02 Oct 2026 19:28:30 GMT",
        "keep-alive": "timeout=5",
        "transfer-encoding": "chunked"
      },
      "body": {
        "status": "SUCCESS"
      }
    },
    "outputs": {},
    "result": "SUCCESS"
  },
  {
    "invocation": {
      "id": "inv-004",
      "affordance": "acceptTerms",
      "timestamp": "2026-10-02T19:28:30.109Z",
      "request": {
        "method": "POST",
        "url": "http://localhost:3001/customers/CUS-3d786679/terms",
        "headers": {
          "Content-Type": "application/json"
        },
        "body": {
          "termsVersion": "2026-09"
        }
      }
    },
    "response": {
      "status": 200,
      "headers": {
        "connection": "keep-alive",
        "content-type": "application/json",
        "date": "Fri, 02 Oct 2026 19:28:30 GMT",
        "keep-alive": "timeout=5",
        "transfer-encoding": "chunked"
      },
      "body": {
        "status": "SUCCESS"
      }
    },
    "outputs": {},
    "result": "SUCCESS"
  },
  {
    "invocation": {
      "id": "inv-005",
      "affordance": "setCustomerDetails",
      "timestamp": "2026-10-02T19:28:30.114Z",
      "request": {
        "method": "PUT",
        "url": "http://localhost:3001/customers/CUS-3d786679/details",
        "headers": {
          "Content-Type": "application/json"
        },
        "body": {
          "email": "jordan@example.com",
          "phone": "555-0100",
          "street": "100 Main Street",
          "city": "Cincinnati",
          "state": "OH",
          "postalCode": "45202"
        }
      }
    },
    "response": {
      "status": 200,
      "headers": {
        "connection": "keep-alive",
        "content-type": "application/json",
        "date": "Fri, 02 Oct 2026 19:28:30 GMT",
        "keep-alive": "timeout=5",
        "transfer-encoding": "chunked"
      },
      "body": {
        "emailVerificationId": "EMV-5a8212b3",
        "phoneVerificationId": "PHV-78de6f04"
      }
    },
    "outputs": {
      "emailVerificationId": "EMV-5a8212b3",
      "phoneVerificationId": "PHV-78de6f04"
    },
    "result": "SUCCESS"
  },
  {
    "invocation": {
      "id": "inv-006",
      "affordance": "verifyCustomerPhone",
      "timestamp": "2026-10-02T19:28:30.120Z",
      "request": {
        "method": "POST",
        "url": "http://localhost:3001/customers/CUS-3d786679/phone/verification",
        "headers": {
          "Content-Type": "application/json"
        },
        "body": {
          "phoneVerificationId": "PHV-78de6f04"
        }
      }
    },
    "response": {
      "status": 200,
      "headers": {
        "connection": "keep-alive",
        "content-type": "application/json",
        "date": "Fri, 02 Oct 2026 19:28:30 GMT",
        "keep-alive": "timeout=5",
        "transfer-encoding": "chunked"
      },
      "body": {
        "verifiedPhone": "555-0100"
      }
    },
    "outputs": {
      "verifiedPhone": "555-0100"
    },
    "result": "SUCCESS"
  },
  {
    "invocation": {
      "id": "inv-007",
      "affordance": "verifyCustomerEmail",
      "timestamp": "2026-10-02T19:28:30.126Z",
      "request": {
        "method": "POST",
        "url": "http://localhost:3001/customers/CUS-3d786679/email/verification",
        "headers": {
          "Content-Type": "application/json"
        },
        "body": {
          "emailVerificationId": "EMV-5a8212b3"
        }
      }
    },
    "response": {
      "status": 200,
      "headers": {
        "connection": "keep-alive",
        "content-type": "application/json",
        "date": "Fri, 02 Oct 2026 19:28:30 GMT",
        "keep-alive": "timeout=5",
        "transfer-encoding": "chunked"
      },
      "body": {
        "verifiedEmail": "jordan@example.com"
      }
    },
    "outputs": {
      "verifiedEmail": "jordan@example.com"
    },
    "result": "SUCCESS"
  },
  {
    "invocation": {
      "id": "inv-008",
      "affordance": "onboardCustomer",
      "timestamp": "2026-10-02T19:28:30.134Z",
      "request": {
        "method": "POST",
        "url": "http://localhost:3001/customers/CUS-3d786679/onboarding",
        "headers": {},
        "body": null
      }
    },
    "response": {
      "status": 200,
      "headers": {
        "connection": "keep-alive",
        "content-type": "application/json",
        "date": "Fri, 02 Oct 2026 19:28:30 GMT",
        "keep-alive": "timeout=5",
        "transfer-encoding": "chunked"
      },
      "body": {
        "accountId": "ACC-f8887c4e"
      }
    },
    "outputs": {
      "accountId": "ACC-f8887c4e"
    },
    "result": "SUCCESS"
  }
]
